<?xml version="1.0" encoding="UTF-8"?>
<osd:OSDSpec xmlns:osd="urn:openiot:osdspec:xsd:1"
 xmlns:prt="http://www.w3.org/2007/SPARQL/protocol-types#"
 xmlns:rdf="http://www.w3.org/1999/02/22-rdf-syntax-ns#"
 xmlns:vbr="http://www.w3.org/2007/SPARQL/results#"
 xmlns:xsi="http://www.w3.org/2001/XMLSchema-instance"
 xmlns:xsi="http://www.w3.org/2001/XMLSchema-instance"
 xsi:schemaLocation="urn:openiot:osdspec:xsd:1 file:/C:/Development/Eclipse_Worksp/Eclipse_Worksp4.2.2/OpenIoT/GitHub/ait-sensap-develop/openiot/utils/utils.commons/src/main/resources/OSDSpec.xsd" userID="http://www.oxygenxml.com/">
    <osd:OAMO id="http://www.oxygenxml.com/" name="name0">
        <osd:description>description0</osd:description>
        <osd:graphMeta>graphMeta0</osd:graphMeta>
        <osd:OSMO id="http://www.oxygenxml.com/" name="name1">
            <osd:description>description1</osd:description>
            <osd:queryControls>
                <osd:QuerySchedule>
                    <osd:second>second0</osd:second>
                    <osd:minute>minute0</osd:minute>
                    <osd:hour>hour0</osd:hour>
                    <osd:dayOfMonth>dayOfMonth0</osd:dayOfMonth>
                    <osd:month>month0</osd:month>
                    <osd:dayOfWeek>dayOfWeek0</osd:dayOfWeek>
                </osd:QuerySchedule>
                <osd:trigger>http://www.oxygenxml.com/</osd:trigger>
                <osd:initialRecordTime>2006-05-04T18:13:51.0Z</osd:initialRecordTime>
                <osd:reportIfEmpty>false</osd:reportIfEmpty>
            </osd:queryControls>
            <osd:requestPresentation>
                <osd:widget widgetID="http://www.oxygenxml.com/">
                    <osd:presentationAttr name="name2" value="value0"/>
                    <osd:presentationAttr name="name3" value="value1"/>
                </osd:widget>
                <osd:widget widgetID="http://www.oxygenxml.com/">
                    <osd:presentationAttr name="name4" value="value2"/>
                    <osd:presentationAttr name="name5" value="value3"/>
                </osd:widget>
            </osd:requestPresentation>
            <prt:query-request>
                <query>query0</query>
                <default-graph-uri>http://www.oxygenxml.com/</default-graph-uri>
                <default-graph-uri>http://www.oxygenxml.com/</default-graph-uri>
                <named-graph-uri>http://www.oxygenxml.com/</named-graph-uri>
                <named-graph-uri>http://www.oxygenxml.com/</named-graph-uri>
            </prt:query-request>
            <prt:query-request>
                <query>query1</query>
                <default-graph-uri>http://www.oxygenxml.com/</default-graph-uri>
                <default-graph-uri>http://www.oxygenxml.com/</default-graph-uri>
                <named-graph-uri>http://www.oxygenxml.com/</named-graph-uri>
                <named-graph-uri>http://www.oxygenxml.com/</named-graph-uri>
            </prt:query-request>
            <osd:dynamicAttrMaxValue name="name6" value="value4"/>
            <osd:dynamicAttrMaxValue name="name7" value="value5"/>
        </osd:OSMO>
        <osd:OSMO id="http://www.oxygenxml.com/" name="name8">
            <osd:description>description2</osd:description>
            <osd:queryControls>
                <osd:QuerySchedule>
                    <osd:second>second1</osd:second>
                    <osd:minute>minute1</osd:minute>
                    <osd:hour>hour1</osd:hour>
                    <osd:dayOfMonth>dayOfMonth1</osd:dayOfMonth>
                    <osd:month>month1</osd:month>
                    <osd:dayOfWeek>dayOfWeek1</osd:dayOfWeek>
                </osd:QuerySchedule>
                <osd:trigger>http://www.oxygenxml.com/</osd:trigger>
                <osd:initialRecordTime>2006-05-04T18:13:51.0Z</osd:initialRecordTime>
                <osd:reportIfEmpty>false</osd:reportIfEmpty>
            </osd:queryControls>
            <osd:requestPresentation>
                <osd:widget widgetID="http://www.oxygenxml.com/">
                    <osd:presentationAttr name="name9" value="value6"/>
                    <osd:presentationAttr name="name10" value="value7"/>
                </osd:widget>
                <osd:widget widgetID="http://www.oxygenxml.com/">
                    <osd:presentationAttr name="name11" value="value8"/>
                    <osd:presentationAttr name="name12" value="value9"/>
                </osd:widget>
            </osd:requestPresentation>
            <prt:query-request>
                <query>query2</query>
                <default-graph-uri>http://www.oxygenxml.com/</default-graph-uri>
                <default-graph-uri>http://www.oxygenxml.com/</default-graph-uri>
                <named-graph-uri>http://www.oxygenxml.com/</named-graph-uri>
                <named-graph-uri>http://www.oxygenxml.com/</named-graph-uri>
            </prt:query-request>
            <prt:query-request>
                <query>query3</query>
                <default-graph-uri>http://www.oxygenxml.com/</default-graph-uri>
                <default-graph-uri>http://www.oxygenxml.com/</default-graph-uri>
                <named-graph-uri>http://www.oxygenxml.com/</named-graph-uri>
                <named-graph-uri>http://www.oxygenxml.com/</named-graph-uri>
            </prt:query-request>
            <osd:dynamicAttrMaxValue name="name13" value="value10"/>
            <osd:dynamicAttrMaxValue name="name14" value="value11"/>
        </osd:OSMO>
    </osd:OAMO>
    <osd:OAMO id="http://www.oxygenxml.com/" name="name15">
        <osd:description>description3</osd:description>
        <osd:graphMeta>graphMeta1</osd:graphMeta>
        <osd:OSMO id="http://www.oxygenxml.com/" name="name16">
            <osd:description>description4</osd:description>
            <osd:queryControls>
                <osd:QuerySchedule>
                    <osd:second>second2</osd:second>
                    <osd:minute>minute2</osd:minute>
                    <osd:hour>hour2</osd:hour>
                    <osd:dayOfMonth>dayOfMonth2</osd:dayOfMonth>
                    <osd:month>month2</osd:month>
                    <osd:dayOfWeek>dayOfWeek2</osd:dayOfWeek>
                </osd:QuerySchedule>
                <osd:trigger>http://www.oxygenxml.com/</osd:trigger>
                <osd:initialRecordTime>2006-05-04T18:13:51.0Z</osd:initialRecordTime>
                <osd:reportIfEmpty>false</osd:reportIfEmpty>
            </osd:queryControls>
            <osd:requestPresentation>
                <osd:widget widgetID="http://www.oxygenxml.com/">
                    <osd:presentationAttr name="name17" value="value12"/>
                    <osd:presentationAttr name="name18" value="value13"/>
                </osd:widget>
                <osd:widget widgetID="http://www.oxygenxml.com/">
                    <osd:presentationAttr name="name19" value="value14"/>
                    <osd:presentationAttr name="name20" value="value15"/>
                </osd:widget>
            </osd:requestPresentation>
            <prt:query-request>
                <query>query4</query>
                <default-graph-uri>http://www.oxygenxml.com/</default-graph-uri>
                <default-graph-uri>http://www.oxygenxml.com/</default-graph-uri>
                <named-graph-uri>http://www.oxygenxml.com/</named-graph-uri>
                <named-graph-uri>http://www.oxygenxml.com/</named-graph-uri>
            </prt:query-request>
            <prt:query-request>
                <query>query5</query>
                <default-graph-uri>http://www.oxygenxml.com/</default-graph-uri>
                <default-graph-uri>http://www.oxygenxml.com/</default-graph-uri>
                <named-graph-uri>http://www.oxygenxml.com/</named-graph-uri>
                <named-graph-uri>http://www.oxygenxml.com/</named-graph-uri>
            </prt:query-request>
            <osd:dynamicAttrMaxValue name="name21" value="value16"/>
            <osd:dynamicAttrMaxValue name="name22" value="value17"/>
        </osd:OSMO>
        <osd:OSMO id="http://www.oxygenxml.com/" name="name23">
            <osd:description>description5</osd:description>
            <osd:queryControls>
                <osd:QuerySchedule>
                    <osd:second>second3</osd:second>
                    <osd:minute>minute3</osd:minute>
                    <osd:hour>hour3</osd:hour>
                    <osd:dayOfMonth>dayOfMonth3</osd:dayOfMonth>
                    <osd:month>month3</osd:month>
                    <osd:dayOfWeek>dayOfWeek3</osd:dayOfWeek>
                </osd:QuerySchedule>
                <osd:trigger>http://www.oxygenxml.com/</osd:trigger>
                <osd:initialRecordTime>2006-05-04T18:13:51.0Z</osd:initialRecordTime>
                <osd:reportIfEmpty>false</osd:reportIfEmpty>
            </osd:queryControls>
            <osd:requestPresentation>
                <osd:widget widgetID="http://www.oxygenxml.com/">
                    <osd:presentationAttr name="name24" value="value18"/>
                    <osd:presentationAttr name="name25" value="value19"/>
                </osd:widget>
                <osd:widget widgetID="http://www.oxygenxml.com/">
                    <osd:presentationAttr name="name26" value="value20"/>
                    <osd:presentationAttr name="name27" value="value21"/>
                </osd:widget>
            </osd:requestPresentation>
            <prt:query-request>
                <query>query6</query>
                <default-graph-uri>http://www.oxygenxml.com/</default-graph-uri>
                <default-graph-uri>http://www.oxygenxml.com/</default-graph-uri>
                <named-graph-uri>http://www.oxygenxml.com/</named-graph-uri>
                <named-graph-uri>http://www.oxygenxml.com/</named-graph-uri>
            </prt:query-request>
            <prt:query-request>
                <query>query7</query>
                <default-graph-uri>http://www.oxygenxml.com/</default-graph-uri>